{"description":"Activated Field Device TUI for the consolidated demo.","displayName":"Field Device Demo","docs":{"markdown":"Declares the Field Device demo's service usage and local state for selected sites and draft inspections.","summary":"Activated field device demo."},"exports":{"schemas":["DraftInspectionState","SelectedSiteState"]},"format":"trellis.api.v1","id":"demo.device@v1","schemas":{"DraftInspectionState":{"properties":{"checklistName":{"type":"string"},"inspectionId":{"type":"string"},"notes":{"type":"string"},"siteId":{"type":"string"},"updatedAt":{"type":"string"}},"required":["inspectionId","siteId","checklistName","notes","updatedAt"],"type":"object"},"SelectedSiteState":{"properties":{"selectedAt":{"type":"string"},"siteId":{"type":"string"},"siteName":{"type":"string"}},"required":["siteId","siteName","selectedAt"],"type":"object"}},"version":"1.0.0"}
