{"description":"Distinct publisher authority on one consumer.","displayName":"Durable event acceptance","events":{"Alpha":{"event":{"schema":"Sample"},"version":"v1"},"Beta":{"event":{"schema":"Sample"},"params":["/site"],"version":"v1"}},"format":"trellis.api.v1","id":"test.events@v1","rpc":{"DropAlpha":{"input":{"schema":"Empty"},"output":{"schema":"Empty"},"version":"v1"},"Observed":{"input":{"schema":"Empty"},"output":{"schema":"Observed"},"version":"v1"}},"schemas":{"Empty":{"properties":{},"type":"object"},"Observed":{"properties":{"values":{"items":{"type":"string"},"type":"array"}},"required":["values"],"type":"object"},"Sample":{"properties":{"site":{"type":"string"},"value":{"type":"string"}},"required":["site","value"],"type":"object"}},"version":"1.0.0"}
