{"description":"Small generated transport and durability fixture.","displayName":"Runtime acceptance","events":{"Changed":{"event":{"schema":"Value"},"version":"v1"}},"feeds":{"Watch":{"event":{"schema":"Value"},"input":{"schema":"Empty"},"version":"v1"}},"format":"trellis.api.v1","id":"test.runtime@v1","operations":{"Upload":{"input":{"schema":"Value"},"output":{"schema":"Value"},"transfer":{"direction":"send"},"version":"v1"},"Work":{"input":{"schema":"Value"},"output":{"schema":"Value"},"version":"v1"}},"rpc":{"Echo":{"input":{"schema":"Value"},"output":{"schema":"Value"},"version":"v1"}},"schemas":{"Empty":{"properties":{},"type":"object"},"Value":{"properties":{"value":{"type":"string"}},"required":["value"],"type":"object"}},"version":"1.0.0"}
