{"description":"Minimal service walkthrough.","displayName":"Orders","format":"trellis.api.v1","id":"acme.orders@v1","rpc":{"Orders.Create":{"input":{"schema":"CreateOrderRequest"},"output":{"schema":"CreateOrderResponse"},"version":"v1"}},"schemas":{"CreateOrderRequest":{"properties":{"customerId":{"type":"string"}},"required":["customerId"],"type":"object"},"CreateOrderResponse":{"properties":{"customerId":{"type":"string"},"orderId":{"type":"string"}},"required":["orderId","customerId"],"type":"object"}},"version":"1.0.0"}
