{"capabilities":{"trellis.core::authority.read":{"allows":[{"action":"call","target":{"api":"trellis.core@v1","kind":"apiSurface","name":"Trellis.Surface.Status","surface":"rpc"}}]}},"description":"Trellis runtime RPCs available to all connected participants.","displayName":"Trellis Core","errors":{"UnexpectedError":{},"ValidationError":{}},"format":"trellis.api.v1","id":"trellis.core@v1","rpc":{"Trellis.Surface.Status":{"errors":["UnexpectedError","ValidationError"],"input":{"schema":"TrellisSurfaceStatusRequest"},"output":{"schema":"TrellisSurfaceStatusResponse"},"version":"v1"}},"schemas":{"TrellisSurfaceStatusRequest":{"properties":{"action":{"anyOf":[{"const":"call","type":"string"},{"const":"publish","type":"string"},{"const":"subscribe","type":"string"},{"const":"observe","type":"string"}]},"contractId":{"minLength":1,"type":"string"},"kind":{"anyOf":[{"const":"rpc","type":"string"},{"const":"operation","type":"string"},{"const":"event","type":"string"},{"const":"feed","type":"string"}]},"surface":{"minLength":1,"type":"string"}},"required":["contractId","kind","surface"],"type":"object"},"TrellisSurfaceStatusResponse":{"properties":{"status":{"anyOf":[{"properties":{"liveImplementer":{"type":"boolean"},"runtime":{"anyOf":[{"const":"live","type":"string"},{"const":"no_live_implementer","type":"string"},{"const":"disabled","type":"string"}]},"state":{"const":"available","type":"string"}},"required":["liveImplementer","runtime","state"],"type":"object"},{"properties":{"reason":{"const":"authority_unavailable","type":"string"},"state":{"const":"unavailable","type":"string"}},"required":["reason","state"],"type":"object"},{"properties":{"missingCapabilities":{"items":{"type":"string"},"type":"array"},"state":{"const":"unauthorized","type":"string"}},"required":["missingCapabilities","state"],"type":"object"},{"properties":{"contractId":{"minLength":1,"type":"string"},"state":{"const":"unknown_contract","type":"string"}},"required":["contractId","state"],"type":"object"},{"properties":{"contractId":{"minLength":1,"type":"string"},"kind":{"minLength":1,"type":"string"},"state":{"const":"unknown_surface","type":"string"},"surface":{"minLength":1,"type":"string"}},"required":["contractId","kind","state","surface"],"type":"object"}]}},"required":["status"],"type":"object"},"TrellisSurfaceStatusResponsestatus1":{"properties":{"liveImplementer":{"type":"boolean"},"runtime":{"anyOf":[{"const":"live","type":"string"},{"const":"no_live_implementer","type":"string"},{"const":"disabled","type":"string"}]},"state":{"const":"available","type":"string"}},"required":["liveImplementer","runtime","state"],"type":"object"},"TrellisSurfaceStatusResponsestatus2":{"properties":{"reason":{"const":"authority_unavailable","type":"string"},"state":{"const":"unavailable","type":"string"}},"required":["reason","state"],"type":"object"},"TrellisSurfaceStatusResponsestatus3":{"properties":{"missingCapabilities":{"items":{"type":"string"},"type":"array"},"state":{"const":"unauthorized","type":"string"}},"required":["missingCapabilities","state"],"type":"object"},"TrellisSurfaceStatusResponsestatus4":{"properties":{"contractId":{"minLength":1,"type":"string"},"state":{"const":"unknown_contract","type":"string"}},"required":["contractId","state"],"type":"object"},"TrellisSurfaceStatusResponsestatus5":{"properties":{"contractId":{"minLength":1,"type":"string"},"kind":{"minLength":1,"type":"string"},"state":{"const":"unknown_surface","type":"string"},"surface":{"minLength":1,"type":"string"}},"required":["contractId","kind","state","surface"],"type":"object"}},"version":"1.0.0"}
